id,content
aRPhMrOJZKZwsj5aXMmAc,​目录传统媒体、新媒体、行业编辑、广告营销、考编（公务员）、高校就业前景看着广，但是钱不多。上下限差别巨大。关键原因是，新闻传播类学科，“社会贡献率”不高。实际上，新闻确实不能增加生产，但是重要性毋庸置疑。就业先看传媒业。传媒业自98年后就连续三年保持25%增长，利税总额超过烟草成为第四产业支柱。当下传媒业发展迅猛，互联网发展更迅猛，所以也是就业人数最多最复杂的领域（一方面互联网属于媒体、一部分不属于）。当前考新传的越来越多了，实际上去处就几类，去的最多的还是媒体。传媒分为传统、新媒体一、传统媒体国内四大传统媒体：报纸、电视、广播、杂志。现在情况是感觉不够乐观，但是有些单位的平台好，资源多，计算钱不多也挤破头皮去。比如央视从中央到地方都需要新闻传播人才。但当下考央视、人民日报、新华社，也是很多人首选。稳定待遇好、有牌面，也能实现自己的新闻理想。实际上，竞争激烈，做媒体都是很忙很累的，我认识的都持续输出写稿。除了央媒，就是地方媒体。比如南方、各个地方党报、北京日报、浙报集团之类的，待遇也不错，前景好，潜力大。还有地方电枧台，南广、北广听说也还行，有知道的欢迎补充。此外，资质社是大头。党报党刊，每个部委单位都有自己的党报党刊，这些内容创作都是对新传专业很看好的。现在县级融媒体出来后，各地抢人也挺厉害，如果不想留大城市，很多县域融媒体也很期待新传专业的人。说说报纸吧，目前报社很多，地方报、行业报、企业报、都市报，都很缺人。如果有新闻理想，很多报纸待遇还可以。我国各类报纸已有几千家，但真正说得上有实力的报业集团却不过五十家，其中以人民日报、南方报业等为代表。网络时代到来，纸媒为了提高竞争力，一方面要充分发挥深度报道的优势，着力于调查性报道和分析性报道，因而对应聘者也提出了更有针对性的要求。新闻传播专业现在不仅仅需要具备良好的文字功底，更需要有良好的新闻敏感和采访突破能力，有时甚至需要具有宏观经济与政策、区域经济和调查性报道的能力。虽然传统报纸要求不低，但鉴于部分报纸为事业单位的身份，依然能够吸引名校研究生的加入。事业单位化的媒体虽然其待遇与地位有保证，但对于有新闻理想与事业追求的考研学生来说，并不一定是最优选择，尚需结合自身情况酌情考虑。广播电视台也是新闻传播专业考研学生未来的就业首选，而且据数据统计，我国广播电视从业人员数量的年增长率约为4%，就是说每年对这方面的人才需求很大。目前广播电视业多采取市场化运作，每年都要引进大量的人才。虽然各电视台招聘人数众多，但一般待遇较低，有较长的项目实习期，因此实践竞争压力比较大。适合真正对广播电视业有热情，并且在制播技术上有突出能力的研究生加入。如果对广播电视业一贯有热情，建议在报考院校时有所选择，例如中国传媒大学在广播电视界的地位不容置疑，其广泛的业界人才网络以及固有的学科设置为个人投身广电业奠定了较好的基础。党报党刊是我们国家思想舆论的主阵地，期刊也是不能忽视的部分。期刊媒体强调个性，市场定位“窄众化”，针对性强，一般要求记者、编辑兼具某一领域的专门知识，同时有较强的文字表达力。结合以上行业分析，它们要求新闻传播专业人才无不涉及多个方向，同时，读书的时候可以广泛涉猎其他专业学科，可选修一些实用性、专业性较强的课程(如市场营销、产业研究等);同时尽可能进入强势媒体实习，有质量的实习经历不仅会使你得到应聘部门的赏识，也会打开你的视野，使你认清自己在媒体行业中的优势和劣势，在以后的学习工作中扬长补短。二、新媒体除了传统的媒体，还有很多新媒体。除了新媒体编导之类的影视行业招人也不少。很多小伙伴在实习的时候在科技媒体36氪等新媒体实习，之后转正，还有人在蓝鲸这样的财经类新媒体工作。工资待遇不错，因为这个工作非常考验你的专业能力了，刚进去7-8K，一两年基本破万。但是说实话，新闻传播的底薪自然是比不上工程师和程序员的。我们这里所说的新媒体是相对传统媒体而言的，主要是指网络媒体、移动媒体及广告公司。相比传统媒体，以数字技术和互联网技术为依托的新媒体，在信息时代是最具潜力的朝阳行业之一，这也是刚毕业的新闻传播专业研究生最热衷进入的行业。作为朝阳产业，新媒体行业更需要市场高手来策划有效消费，因此媒介经营管理方面的人才尤其紧缺。由于没有传统路径制约，网络媒体更倾向于“企业化运作”。目前，网络媒体产业的发展遵循“创意产业”的规律，广告经营人才也很适合投身网络媒体。网络媒体不像报纸期刊业“求精求专”的用人需求，其对个人的经营意识与创新精神方面要求更高。可多读媒介经营管理、传媒市场营销方面的书籍，关注产业新闻，了解国内外传媒市场的运作规律。学习一些网站制作技巧以及相关的技术软件也非常必要。此外，在学习与实践期间，注重培养自己的创新意识与市场嗅觉很重要。相对于传统媒体，新媒体的用人标准明显不同，其需求的专业方向也相对广泛。另外，像广告公司、新闻发言人、媒介研究公司、时尚杂志编辑等也是新媒体行业中较受毕业学生欢迎的行业。但这类公司可能对同学们在个人特长方面有更深的要求。以媒介研究公司公司为例，它需要我们在读研期间，有跟随研究传播学研究方法、受众分析等领域的导师参加一些科研项目，并能掌握各种定性、定量的媒介研究方法。总的来说，这几类公司，必须要求学生有前期实习的经历。我身边的去腾讯、字节的挺多的。但是感觉还是压力太大，现在互联网也不是首选了。除非个人特别看重钱，同时也不注重潜力。因为，红利时代确实过去了。三、行业编辑相比传统媒体具有较高素养的编辑、记者，有些人群虽然从事的是新闻事业编辑职业，也许并不需要很专业的新闻调查研究能，如网络编辑、影视节目制作公司高级编导、线下刊物编辑、企业刊物编辑、记者等，但他们同样需要具备简单新闻传播知识，上述行业也为新闻传播专业硕士提供了大量的就业机会。拒不完全统计，目前我国的网络编辑从业人员超过300万人，而传统新闻从业人员只有75万人，网络媒体从业人员已经从规模和数量上超过传统媒体。虽然人数众多，但随着互联网的更深入发展，网络编辑也成为市场上抢手的人才，尤其是跨专业新闻传播学研究生。做一名网络编辑，首先要有扎实的文字功底;其次要熟知新闻的相关知识，对网络上出现的新闻、信息、趋势要有足够的敏感度;还要能熟练使用Dreamwaver、Flash等网页制作软件和一些编辑发布软件等。其次是影视制作编辑和企业内刊编辑。随着电影、娱乐业等行业的迅猛发展，这些公司对影视节目的编、播、采人才都有广泛的需求。如果有较强的新闻敏感性和新闻写作能力，熟悉电视节目制作流程和电视表现手法，思维活跃，具有较强的文字功底，这类新闻学专业毕业的研究生就业前景非常广泛。四、广告营销广告营销公司属于乙方，就是为客户服务的广告类公司，或者营销类公司。京东之类的很多公司都招大量新闻传播人才，待遇还不错，可能就是比较辛苦。薪水也ok，6-7K，一两年基本破万。我小伙伴在刚好在京东，要的就是新闻传播学的。五、考编（公务员）很多同班女同学就有这个打算，想着离家近，不想漂泊了。还有考选调生这些，当然也是公务员的一种。新闻学考公务员的很多了。还有一些想毕业当老师，稳定。或者，继续深造读完博士继续当大学老师。 六、高校这是一大部分新传人的出路。比如我博士师哥就一直想留北京，新闻传播类研究生一直读，也就科研单位和教职两个选项了。（*数据来源：职友集，取自约32万份样本）新闻传播学细分专业很多，去哪能不能去有时候也是玄学。大概罗列了一下，不知道能不能帮到你。和原来写的差不多，又加了一点点东西。对了，学历很重要，很多媒体招人，都要求研究生学历。而且就算不要求，研究生毕业去单位是有一个明显优势的，就是有学历升值快，后劲足。并且经过专业的学术训练，你的思维和理论水平还是摆在那里的。子淡18 次咨询5.0中国传媒大学 新闻学硕士16432 次赞同去咨询
xRVtiZ-_sG8dpcbFanzTD,泻药，新闻学进来聊聊新闻业。不少胖友有一个记者梦，想以记者身份探索社会与人性，感受理想现实之间各种微妙情感和瞬间。但真做上这份工作，抹掉滤镜后是否还会热爱？还想追寻新闻的价值与意义？明确以上还得靠实践，最可行的办法就是大学多实习。简易版：关注本市报社、电视台渠道；进阶版：向岗位多的大厂、大媒体投简历（如：字节、芒果官网常年招实习）。一、当新闻专业主义照进现实第一个我去到的“现场”是大连人民文化俱乐部，有幸采访杨赤、凌珂二位老师（关注京剧的胖友或许了解）。可能文化、民生类新闻，天然不如时政、商业那么有“高级感”。但首次采写，也是至今体验最丰富的一次。真正走出书本“做新闻”，一切都来得新鲜、畅快。记者给我的初印象就是——能免费到处走后续多元媒体经历让刻板印象被打破，但彼时感受无疑坚定了自己从事新闻业的决心。如果进入媒体实习，最后想留下来，给大家两条实在的建议：1、简单工作做出色大多媒体都没有明确带教制，机会主要靠自己争取。比如我主动询问合作过的前辈需不需要一些小的帮助，从而争取到发稿机会。这次采访要跟植物学家一起爬山、观察植物，但同行前辈因体力不支跟不完全程，所以有了一次独立采访的机会。后续工作只是简单的整理，但我多做了一件事，就是看了一些关于植物的书，于是在我整理的资料中提供了不少资料。尽管这些东西最后可能用不到，但就是这种“简单工作做出色”的态度让前辈关注并认可，又让我收获了另一份工作任务。可能有人会说这是卷，可多元看待 :D2、独立出稿是王道大多市场化媒体（如三联、芒果），实际并不太看重学历（敲门砖相对也重要），只要能独立出稿就是王道。这种能力不是一蹴而就的，需一步步积累。先不要放弃每个写小稿子的机会，有了可看得见的储备之后，才能够到更大的目标。比如我在某家报社实习，一开始会写一些资讯、公主号文章。有了积累，在选题会就更有底气报选题，把之前的小稿转化为大稿。之后基本上一周就会写一个新版的稿子，在这之后也开始陆陆续续接别的选题，有了独立产出的能力。二、疫情凸现记者使命   疫情这个特殊节点，让媒体有了一次回光返照的机会，在这段时间也真正看到了记者的使命与媒体的意义。最开始有同事去武汉采访，口罩稀缺，好不容易凑到的N95口罩还送给了医护人员。看到报道，也体会了个体生命的渺小与敬畏、感受到这一时刻记录与讲述的重要性。引述一段话：看到大型公共事件中的具体的人和看到个体故事背后错综复杂的时代与系统，是公共媒体在网络社交时代的重要意义。记者工作的价值也在疫情中被充分体现。三、作为记者的荣光与限制记者职业有闪耀之处，但也有背后看不到的限制，两面才构成了这份工作的完整性。前者大家自然欣然接受，但被隐藏起来的那一面更是评判你是否热爱的因素。感受荣光的瞬间：让弱者被看到曾接过一个选题“环卫工人猝死在街头”，调查后发现并不是因为救治不及时，而是突发疾病去世。到这里似乎选题失去所谓的新闻价值，应该把它放掉，但是从中看到了无力者的故事。如果有人想要被倾听、想要讲述、想被看见，那记者的工作就有意义。无力改变的东西：有限的意义很多时候也会感受到，媒体无法发挥任何作用，比如说一些特殊事件，即使很有新闻价值但不能报道。还有另一些事件，即使报道了，但对当事人没什么作用，没有帮助他们解决什么实质性的问题。比如汪康夫事件，到最后他去世都没有证明清白，记者采访之后又能发挥什么作用？现实：出差、DDL和无处不在的焦虑但很多时候，在要写好与DDL的纠缠中存在太多的焦虑。写稿的不确定性因素很多，不一定就在哪块被卡住，而思路畅通了也不见得就会写好，改来改去是常态。为了深入选题所以会经常出差，下一个落脚点不一定在哪里，很可能环境很恶劣甚至存在安全隐患。去到新的环境也不知道如何寻找采访对象，没有想出去走走领略当地风土人情的心情。四、关于媒体工作Q&AQ1：看重实习经历吗？市场化媒体更看重出稿能力，几段实习经历不重要，更重要的是你做了什么，有什么区别其他实习生的能力。Q2：实习就感受到压力，但是稿子成型又有成就感，怎么平衡两者？去建立生活秩序感的事情，比如游泳，让自己从压力中抽离出来。Q3：采访对象拒绝沟通产生焦虑怎么办？没有采访对象不能被替代，并不是你的原因，拒绝采访是采访对象出于自身利益的考量。Q4：不敢报选题，害怕被否怎么办？除了新闻价值之外，选题与媒体的调性相关。不要害怕被否，不报永远不知道是否成立。Q5：媒体的薪资待遇如何？不保证大富大贵，但能在北京过上相对体面的生活。Q6：媒体工作的假期安排如何？好处在于不需要坐班，所以少了很多通勤时间。弊端在于可能周六日需要赶稿子，而自己休息的时候朋友在上班。对于一份工作，不能只看到光鲜的一面，可能背后的一地鸡毛你没看见。在一个行业的“门外”和“门里”看到的肯定是不一样的。如果想进入媒体工作，不妨先去实习一段时间看看，然后再去体会自己的感受，再去决定要不要当作职业来发展。如果依旧坚定，那么这条人迹罕至的路也将成为你人生的重要一环，一定会看到更别致的风景。
b1Y08iWur9XnmNYujPOEA,去年夏天新传研三毕业，我只能大概说说我身边的同学就业情况。和我读研之前想象的有所不同，肯定也是大家没有想到的：1.考公考编的同学特别多后疫情时代大家最关心的是稳定性，加上一些舆论方面的影响，基本一半以上的同学都参加了考公考编，关于考公的地方大家一般都是选择我们学校所在地的省会，也有些同学回老家，也有些同学会冲一下高薪的江苏浙江和广东。关于岗位的话新传其实挺吃香的，可以选的岗位还挺多，像宣传b这种就是特别对口的。还有的同学也会偏向于选择更加稳定的国企。能进到那种资源型国企或事业单位，像什么烟草、石油、国电和医院之类的也是非常香的。像公务员的话如果是非省会城市或者那种经济很好的地方，一般就是月薪2000到4000左右，像经济好的地方或者省会核心圈层的话一般一年拿得到15w左右，江苏广东地方好的应该还有20w+。比较好的国企一般研究生还是拿的到12w-20w左右的年薪。像新传专业进国企或者事业单位一般就是做党建，宣传或者人力之类的。还有一种进体制的选择就是人才引进，一些县城（尤其是比较有钱的县城）会开出很高的安家费（有的高达60w），然后招聘研究生去当地工作，新传专业的一般就是进融媒体中心、文旅部门或者宣传b门。2.去媒体的同学并不多不管是自媒体还是专业媒体都不多，根据身边同学的情况，一个年级最多不超过5个人。我感觉一方面是专业媒体在走下坡路，薪资待遇也不是很有吸引力，而且现在媒体……很多同学也没啥新闻理想了。自媒体就更不用说了，很不稳定，风险太高，而且研究生读三年书其实对做自媒体没啥帮助，想做自媒体还是更重经验一些。3.想要高薪就去互联网还有一个方向也很受欢迎——互联网，适合新传的岗位有运营、产品、品牌和人力。薪资是真的高，最少也是20w起，最高的身边有个女同学拿了40w+，算是非技术类岗位的天花板了。但是要求有很多实习经验，而且能力要很强（比如表达能力，创新能力和抗压能力）才驾驭的了，能力一般的可能进去会很焦虑很挫败，而且基本可以选择的城市就只有北上广深，连成都好的互联网岗位其实都不多。4.硕士研究生也有机会进高校还有很少一部分同学会选择去二三本或者民办学校当老师，也挺不错，工资不会很高，6k-8k左右一个月，但是挺轻松的，有寒暑假，而且学校不好也没啥科研压力，有的学校甚至可以不坐班。同时，社会地位还可以，学生也会很尊重你，整体应该挺幸福的。5.少数人要走的路最后就是极少数同学，可能每年十个左右的同学会选择读博，读博是要求至少4年，每个月3000左右助学金。时间成本还是蛮高，读出来都三十岁了。如果家里条件好，不着急赚钱养家，自己又对学术研究有兴趣有天赋可以尝试。川大新传的博士发文多且质量好的有机会进985211，但大多数博士还是基本进个重本就算不错的了。整体来讲，川大新传的就业可能不是太理想主义，但从现实的角度来说还是非常不错的。首先川大新传是整个西部地区最强的，出来基本在西部地区都可以横着走；另外在文科中，新传的优势也是很明显的，除了经管类，整体就业情况最好的应该就是新传了（大家也可以了解一下其他文科专业的就业情况，看是不是像学长说的那样）。一方面，因为具备一定的互联网传播思维，新传进互联网公司很有优势；另一方面新传在文笔和媒体运营方面的优势也是企业党建、宣传方面非常喜欢的。当然，也正是因为新传在文科中算是就业不错的，川大作为985平台也很好。所以不知道题主是不是考研党，要选择这条赛道就要做好充分的准备。
-VXJeC2WxF9nKpay-fExa,分享一下北大mjc毕业同学的就业情况（1）2020年就业情况：主要为事业单位，国企、政府，互联网平台等，典型的企业为腾讯科技有限公司，人民日报、新华社、财经新闻、建设银行、中国宣传部，烟厂、阿里等。（2）2019年就业情况：主要为互联网公司、国企、银行、政府等，典型的企业为腾讯科技有限公司，中国宣传部等。（2）2018年就业情况：2018年2名同学出国深造，分别去了敦克大学和德克萨斯大学奥斯汀分校；就业方向：主要是文化传媒、公共管理、信息服务和金融等，如人民日报、新华社、中央广播电视总台等；（3）2017年就业情况：出国深造：2名同学中有1名同学，去往实际排名前50名的学生；就业分布，中国移动，新华社、中国外交部、中国宣传部、人民日报等（4）2016年就业情况：升学深造：北京大学继续求学，在校升博士；就业分布如国务院办公厅中国政府网运性中心、人民日报等；
VVtTXTY8Hx4YCkGc9qhQt,"新闻学(或传播学)近几年就业前景如何？1.新闻传播学专业的毕业生毕业后主要从事媒体传播的工作,一般在报社、杂志社、出版社、电台、电视台、或是机关企事业单位的宣传部门工作,但这只是传统的就业方向,现在已经不仅仅局限于以上单位了,很多毕业生还会从事文案、广告设计、广...2.目前新闻传播学专业就业前景大致可以分为三大类:传统媒体、新媒体策划、行业编辑。传统纸质媒体、广播电视媒体和期刊是我国传媒市场的中流砥柱,他们依然是新闻潮流的主角,除报纸外,广播电视台也是新闻传播专业考研学生未来的就业,而..."
C7v0FY11HwoLxyyKPrPS9,在很多人的印象中，新闻专业对应的就业领域就是报社、电台、电视台这样的“一报两台”。但从部分高校公布的就业信息来看，新闻专业学生的择业范围并未随着传统媒体的式微而缩减，反而由于新媒体的发展而不断扩大。通过以上数据对比，说明新传类专业的就业，依旧能打。不管你想追求稳定进入体制内，还是想要在大厂干出一番事业，新传学生总能找到自己的出路。而且很现实的是，考研之后，出来工作的待遇那肯定是不一样的。
3ENO3R6OXxcWHkwLNy13m,"新闻学(或传播学)近几年就业前景如何？1.就业前景看着广,但是钱不多。2.上下限差别巨大。关键原因是,新闻传播类学科,“社会贡献率”不高。实际上,新闻确实不能增加生产,但是重要性毋庸置疑。 就业先看传媒业。传媒业自.."
