id,content
MAmYRba7sxnDt63cRioe1,新传大四在读来了，不知道你是特指新闻学，还是泛指新闻传播大类，但总体来说能去的地方其实是类似的。我认为当你学了文科之后，且你又是就业导向时，你需要转变思路。因为通常我们认知中会有：选了一个专业-好好学习课内知识，扎实本领-毕业后去对口的领域。这种学科经典的代表比如医学和工科。医学生或者工科生按照这种思路当然没有问题，因为长期在专业领域的学习已经为他们铸起了学科壁垒，到时候企业或医院招聘的时候确实也非这些专业不可。但是如果人文社科的学子按照这样的路走是明显有问题的，其一是教材与实践的脱节，现在都是互联网的整合营销，有多种新媒体技术，而课上老师教的可能还是传统纸媒的那一套，因为一些年纪稍大的老师本身的工作经验就是纸媒的；另一方面，作为大学下的二级单位，现在绝大多数学院都在转向学术化而非就业化，相比于学生好不好找工作，学院可能更在乎学生能不能发好论文，因而在教学的时候也会更加偏向学理化。而通常情况下这些人文社科的知识要么是很难变现的（比如新闻史的研究，早期基层传播研究，媒介史的研究），要么是带有与商业冲突的批判色彩的（算法歧视研究，议程设置研究，网络民粹主义研究），要么是一些没有什么理论深度，把常识总结出来的（SWOT理论等等，多见于广告系）。此外，还有一些象征性的新闻实务课，比如视觉传达，新闻采访与写作，视频编辑等，这些知识往往与业界直接对接，像是浙传，中传这些学校可能会比较注重这方面的培养，但在一般综合性大学，尤其是以学术为导向的大学，这些课程老师和学生重视程度普遍不高，并且上完这门课后学院提供平台去锻炼相关能力的机会偏少，课程考核相对也水，所以大家掌握的水平还是不够，单凭一两门课程很难达到业界需要的水平。所以如果新闻学院的学生希望靠自己在大学里所学的知识换来一个良好的就业前景是不太显示的，我之前在发现这一点后也曾对我自己的专业学习产生了一些自我怀疑。但现在我慢慢意识到，选择一个专业的同时，也同时选择了大学不同的生活方式。绝大多数新闻学院课程安排较少，课后空余时间较多，对比理工科学生大二大三（甚至大一）就早早提前进组，兼顾学业的同时又要花不少时间在实验室里，新闻学院的学生则可能遍布学校各种学工、社团。选择新闻学所给予你的大量可支配时间也是很重要的。有了这么多空闲时间，从就业角度，你可以走以下几条路：全力准备考公，新传专业岗位相对多+时间充裕你上岸的机会自然就大很多知识需要去业界实习中才能获得，多去刷刷实习。如果你对媒体行业还抱有热忱，大可以选择传统媒体行业，好处是传统媒体实习的活没那么多，坏处是基本没有工资，或者工资少的可怜；你也可以去互联网/快消/咨询等行业去实习，如果bg不够硬不要想着一步登天，可能最开始的实习title不是很大，但你慢慢积累起经验，一切都会好起来了往专业实务方向走，有的人对摄影，纪录很感兴趣，因而会尝试自己拍电影，或者参与到电影纪录片的创作中，在影视相关公司实习。但这需要你个人对此有强烈的内驱力，因为理论上路是走得通的，但是真正去的人比较少准备准备考教师资格证，回去当个语文老师之类。事实上，身边确实有不少学长学姐在走这条路暂时先想到这么多，如果有流量，后续再补充
W-zB0tJsyk6ZCCDFkkl27,中规中矩一点就是媒体机构——记者、编辑。也可以考公考编。发散一些可以进入互联网公司、电商公司、文化传媒公司——新媒体运营、用户运营、社群运营、产品运营、文案、内容、策划、营销、市场、剪辑、出版、广告都可以做，只不过除了新闻以外要额外掌握一些专业技能。更多还是看个人能力。新闻专业的优势在于新闻敏感；对当下媒体、舆论传播的了解；写作及内容鉴赏能力，沾点边的岗位都可以尝试。个人感觉就业前景一般。
WSkdiKwC4WT40o7c03ue_,提前准备考公、事业单位吧，或者国企。
mIVRKXZ1gZ004G_1N2T5J,学新闻尽量在一线城市
_m6N_xc_feDHHYpuoB0pl,学校什么层次，所在城市什么层次，家里对你的期望是什么
w_fEE1yN5iILCT16ccnLd,按张雪峰的话来说是能文能武。能转专业尽量转吧。法学财会汉语言。以下是官方回答，听听就算了：新闻学是一个广泛的学科，涉及新闻、传播、媒体、公共关系等领域。因此，新闻学专业的毕业生可以从事很多不同的工作，如记者、编辑、出版人、公关专员、广告文案、新媒体运营等。就业前景方面，随着社会的发展和媒体的多样化，新闻学专业的需求不断增加。尤其是在数字媒体和社交媒体的快速发展下，新闻学专业的毕业生有着广阔的就业前景。另外，新闻学专业的学生通常具备较强的写作能力、批判性思维能力和沟通能力，这些能力在职场中也非常重要。
xxCjHvpp2AAkOoB8qgO5c,背景：2010-2014 新闻学本科，2014-2017 传播学硕士，今年整好是本科毕业10周年，联想到之前被张雪峰说让家长把孩子打晕了都不能让孩子理科高分报新闻的说法，之后某新闻教授站出来反驳张雪峰说新闻是能文能武，再结合自己这10年以来的经历和心路历程，孰对孰错，评判自在心间。先说结论：我确实想回去打晕当年报志愿的自己，甚至更想回去打晕当年选文理的自己。作为父母都在三线城市体制内工作的小镇做题家，从小被父母一边说：女孩子学个文科挺好的，不用那么辛苦，可以稳稳定定在单位里干个文职，一边又期待我成绩拔尖，力争上游，在各个方面保持优秀。在这样的理念灌输下，高一选文理时，在物化生都还不错的情况下，我还是选了相对容易考高分的文科。而后08年汶川地震、奥运会这些大事件里，奔波在一线的新闻记者又让人看到了新闻在一线的魅力，以及闾丘露薇的光环影响，让我在报志愿的时候，想都没想的选择了国内知名的新闻学专业。而今，本科毕业十年，此时此刻回忆过往，结合当下，认真思考这个专业给我带来了什么，似乎总结一下就2点：1.对权威机构/个人的不轻信记者（理论上）都在追求事实的全貌，力争平衡报道，还原事情本身的样子，所以对单一信源发布的内容，总是秉持着先怀疑再求证的心态。然而，面对罗生门频发+权力一言堂的常态，找到事实的另一面变得难上加难。因此，不轻信而又无从查证，反而让我在钻牛角尖和漠不关心中间反复横跳。但，依旧非常敬佩还在坚持做调查性记者的人，他们舍弃的可能不止是一份安稳舒适的生活，甚至要面对各方对人身和家人的安全威胁。这一点在十多年前的课堂上，听资深调查性记者的分享时，就已经非常触目惊心。试问我是没有这个魄力去allin的，更不用说，大概还在只能给我一个勉强维持生存的薪资的情况下。2.对传播方式的理解和认知一路从大众媒体走向社交媒体，当年学魔弹论的时候研究的还是电视，一转眼现在一线城市的年轻人甚至已经开始不看电视了。媒介的变化必然带来传播理论、手段和媒介形态的变化，那些理论逐渐成为新闻传播流派的历史沿革，很难想象这还是当年要用一个学期去理解+死记硬背，以应对闭卷考试的内容。而新的传播范式，怎么说呢，可能一个自媒体从业者都比我们这些科班出身（但没有一直从事新闻传播）的人理解的要深入，就看当下坐在高校里的教授研究的课题，无一不是在从社会实践中提炼出一些理论观点。一方面是因为媒介发展确实快，很难再复刻理论指导实践的流程，另一方面是这确实也符合“一切皆要踩热点，快快快冲冲冲”的时代主题，可能时间长了，连教授们也忘了，为什么中青报当年有个专栏，叫冰点。如果说以上这些还是这几年的情况，那当年毕业没有选择做新闻的原因就显得十分简单：在校实习期间，当我在一家当时还很不错的新闻门户实习时，每周选题会，所谓总编辑的开场白总是“我们最要紧的，是要把上三路的选题，做成下三路的样子，这样才能被人看见”。这个总编辑后来还被举报各种贪污和不正当关系，也不了了之了。但，这样的人能坐在总编辑的位置上，还是非常说明问题了（毕竟当在一个屋子看见一只蟑螂的时候，可能已经有一窝蟑螂在暗处繁衍横行了）说回自己毕业之后的发展先是选择了一个和媒体有点沾边的工作，然后见识到了准备好通稿，好吃好喝备好红包，伺候一个个拿着通稿排版发布的媒体老师的常规操作，甚至一个活动，他们中的一部分人都是迟到早退的，通稿和红包到手，签到写好即可。之后彻底转行，远离媒体行业后，见识到了曾经从媒体出来的所谓资深媒体人，用大一我们在学校学的那些理论和实务去买课圈钱。遇见了不轻信一切最后愤世嫉俗，对所有事情都看不惯，看不上，不信任，怼天怼地怼空气，但最后一篇甲方的稿子都写不明白的资深媒体人。接到了在媒体干了5年想拿着所谓的媒体资源转行做企业公关的校友的简历，但赶上了经济下行，企业优先砍掉的往往是公关/市场，这些成本中心+长期慢回报部门，所以简历石沉大海难以转化成工作offer。当然还有一大批在一线，或者是真的有新闻理想，或者是只为有个工作，或者是暂时没有更好的工作的从业人员，他们就是我们，没有学阀和背景的普通人，只是在这样一个投入产出比非常不匹配的行业，打一份工。凡此种种，我是真的很想打晕当初的自己。说新闻学能文能武的教授，我不知道他这里说的能文能武是什么，在实际的职场里，我更多的是看到了新闻毕业生求职的艰难，升职的缓慢，薪水的卑微。在这种情况下，依旧能坚守初心的人，我愿称之为真正的强者。但是，一个社会里，哪里有那么多强者呢？你我不过只是普通牛马，而这个专业，很难让我们有机会吃到更多的饲料。
CaRZIoudfYzXLD5WSNOaC,大家好，我是蓝芽，90后，湖南某二本院校新闻学毕业8年。最近适逢各省市高考填志愿，很多同学都很关心自己想要学的那个专业未来就业如何，我想起来3月份的时候做过一个采访，采访了我的4位同班同学，真实的描述了我们作为文科生，毕业后的一些去向，可以供大家参考。 G同学，女生，湖南常德人，毕业后回了老家，目前已经结婚生娃，孩子两岁了。G同学大学毕业后先是去一家报社实习，后面就回到了老家上班。在老家的工作是在县城的电视台当记者，她在里面干了有6年的时间，主要的工作内容是拍摄，写稿，剪辑，现在已经离职了。G同学说，其实这份工作，内容倒是能做，就是工作环境不是很好，人际关系是一方面，另一方面职业发展挺不确定的，待遇也低，因为是编外人员，各方面比较苛刻，在综合考虑之下就离职了。离职后自己搞了一个工作室，主要接一些宣传片的制作，这个也比较依赖关系资源，目前的业务情况不是很稳定，但觉得对个人的能力提升还是有比较大的帮助。G同学目前已经结婚生娃，老公的工作比较稳定。G同学认为，新闻学这个专业没什么实质性的意义，没有学你也可以做，因为你做的东西就是照本宣科。再加上这种二本学校，学历也低，考公务员也没有什么竞争力。Y同学，男生，湖南湘潭人，目前在长沙发展。 Y同学对新闻学本身是很有兴趣的，大学的时候积极参与了学校社团，学校报社的工作，还去了当地的报社和新闻网站实习，买了单反学习新闻摄影。大三结束后，Y同学去当兵了，延期了一年毕业。毕业后一共经历了两份工作，一份是房地产行业的策划，一份是体育行业的宣传推广，就感觉很不稳定，现在很想考进体制内。G同学认为选专业要看你的家庭，如果你的家庭不是很殷实，家里需要你工作来赚钱，那就不太建议学新闻；如果真的对这个专业有兴趣，想要学的话，不能是二本，至少得985，211这样的学校。如果家境殷实的话，父母不靠你赚钱养家，你学任何一个专业都ok. W同学，男生，湖南娄底人，毕业后打过工，创过业，现在在广州发展。W同学的大学过的比较空虚，因为对学校教的东西不感兴趣，经常逃课。W同学毕业后的第一份工作，是在长沙做电话销售，3500一个月，干了3个月就离职了。W同学每天要打200个电话，每天回到家一句话也不想说，差点就抑郁了，还瘦了十几斤，W同学忍无可忍，就听家里安排回老家上班了。回老家是去了民政局做普查类的工作，就是每天去乡镇开会，普及一些东西，这个班上得挺舒服的，吃好喝好，还挺受尊重，半年内又胖了20斤。半年后W同学觉得薪水太低，一个月还是只有3000多，W同学接受不了这种经济状况，就想出来创业。随后就来了广州，父母资助开了烧烤店。烧烤店开了两年，运营得挺好的，一直开分店，规模最大的时候是开了5家店，2020年疫情来了，一切归零，倒欠银行几十万。然后W同学去做了保险业务员，目的是为了打工还债。还得差不多了，W同学有点想认命了，就去考公务员，参加了广东的省考。备考两个月，W同学考了一个很高的分数，吓了大家一跳，但是体能测试没过，所以公务员之路又断了。接二连三的打击，W同学这次真的抑郁了，去看了心理医生，玩了3个多月，放松心情才走了出来，后面做保险的同事介绍了一份工作，就是做葡萄酒销售。W同学迄今为止就是在做葡萄酒销售，目前觉得还比较适合自己，状态不错。W同学已经结婚，对象在医院工作，W同学说不会考虑在广州买房，但打算今年要个小孩，毕竟年龄也到了。Z同学，女生，山东人，毕业后就回了老家发展，目前已经结婚生娃，孩子3岁了。Z同学是山东人，比较恋家，毕业后就回了老家工作。她先是去老家这边的一家报社实习，实习了一年之后，发现转编制无望，就辞职了。辞职之后还尝试做了新媒体，运营策划两份工作，随后就结婚了。结婚后觉得公司的运营策划工作不是很稳定，就去了一家国企下的子公司做党建工作。这份工作的要求是要求新闻学+党员，刚好都符合条件。结婚两年后有孩子了，老公的工作是在国企，工作比较忙，婆婆不太想参与小两口的生活，Z同学就全职在家照顾孩子了，所以Z同学现在是一名全职妈妈。Z同学认为，如果报读新闻学专业，想从事对口的工作，比如进权威的媒体机构，需要考虑一下家里的经济条件，人脉资源，学校的层次。如果只是单纯的喜欢，但是可以接受不从事相关工作，那就随便报吧。最后来说下自己吧，我毕业后一直在教育类的公司从事运营工作，刚开始在长沙工作了两年，觉得薪资太低来了深圳，目前已经在深圳呆了6年了。出于对主业不确定性的担忧，我很早开始折腾一些副业，现在在做优势教练，专门帮人挖掘天赋优势，找到适合自己的主副业。我毕业后的历程没有很大的逆袭，只能说走的相对顺当。现在进入30岁会有职业危机了，但也没想过要考公，我一直是个想法比较多的人，以前就想着自己出来闯一闯，现在在外面也闯了好几年了，都尝试过了再怎么样也不会后悔了。我对新闻学专业的看法可以看这一篇如果你看了我和我同学们的故事，有什么想说的，可以在下方评论区留言，有问题想要咨询的话，也可以找我交流。
NCaLovui_7JxhMn5YR5QL,写在前面：大学专业如何选择，历来是家长和考生比较关注的问题。提前思考规划，未来报考才能心中有数。本系列专业分享，将会从该专业的就业入手，看未来就业方向，再考虑报考院校选择问题。本篇分享的是新闻学专业。--去年，就该专业是否值得报考，某高校新闻学专业的教授和志愿填报名师看法相左，当时还引起了大众的热议。不管是专家教授也好，还是名师也罢，作为考生及其家长，听其言论只能作为参考，实际情况如何，还需要主动验证、分析思考。那么，如何去验证呢？一是可以看该专业的市场需求情况；二是可以看高校的该专业毕业生就业质量报告；三是可以看该专业的院校分布情况。01 先来看市场需求情况。笔者查询了全国24个代表性城市，现选择一些城市的该专业招聘岗位放上来，初步了解一下市场面上的情况：先说一下整体情况，24个城市中，该专业招聘情况都还可以。还有一点比较特别，地区间的招聘需求量，差异较小，经济发达地区和欠发达地区，虽然岗位薪资有高低，但需求量都差不多。比如，上海、广州等一线经济发达城市，与郑州、长沙等地来比较，招聘信息发布条数都是200多条。再来看具体岗位，上表列出了北京、上海、无锡三个城市的部分岗位情况。该岗位在一线大城市，去报社等专业媒体从事记者、编辑等岗位的机会，是比二三线城市机会多的。那么，在二三线城市，该专业岗位有哪些呢？以无锡为例，可以做新媒体平台的记者、编辑，做公众号内容文案，这样一类工作岗位较多；也有新闻采编岗位，这类岗位较少（非专业的媒体单位）。你可以发现，该专业就业，与新媒体关联较为紧密。有哪些新媒体呢？公众号、各类视频号（某音、某红书等）等等，都是依托互联网技术的新媒体。而就是专业的报业媒体、电视台等，也与新媒体有着很大的关系，再有市场上的各类传媒公司，或者是相关行业公司，也依托新媒体平台展开业务，扩大影响力。新媒体行业发展那迅猛，依托的是互联网媒介，可以不受地域限制，各地的人才需求量都比较大。--那么，新媒体行业的进入门槛怎么样呢？有人说，新媒体门槛很低，什么专业的都可以做，但真实情况真是如此吗？开个号，能发文、发视频，就能算入行了吗？什么是入行？最直观的是，能不能产生收益，就是付出劳动，有合理的经济回报。能真正入行的人并不多。以自媒体为例，笔者业余，观察研究自媒体3年，也关注了一些这一行里面的牛人，发现这一行的入行门槛，其实是不低，要求有较强的写作能力、选题能力、思维逻辑力、学习力等等能力。要进入这个行业，主要看是不是具备这些能力，至于是何专业，倒并不一定。比如“某某大V，有哪个是新闻学专业毕业的？”、“某某是非新闻学专业的，公众号做得风生水起”、“该专业做新媒体更有优势”等等。以上就是去年该专业引起争议时，网友的讨论。有争议，说明双方都占些理。实际上，他们尽管有争议，但却有一个共同的点，都是以新媒体行业作为讨论背景，说明是认可行业发展前景的。那么，对于该专业的学子，关注的点应是如何把握住行业发展机会。--02 再来看高校的就业质量报告。主要看毕业生就业单位、就业薪资、升学深造等情况。以暨南大学为例，2020年，该校毕业生就业单位有报社、出版社、电视台、广播等传媒机构，就业岗位有记者、网络编辑、影视节目制作编导等；2023年，该校本科毕业生协议就业率为51%，读研升学比例为36%。--03 最后看该专业学校分布情况。2023年，软科中国大学专业排名中，该专业被评为B级上的院校有163所，部分开设院校如下（排名前30）：由上表可见，排名前三十的院校中，有27是211类大学，其中，985大学有16所，包含了国内多所知名大学。重点大学在该专业布局，也说明了该专业的价值，高校是在为行业培养高素质人才。可以说，如果你的实力较强，有机会进入到到排名靠前的院校，未来就业岗位的档次大概率不会低，有较大可能进入知名的报社、出版社工作。如果你的实力一般，考取的是普通院校，就业机会也是不少的，而且就业方向有很大一部分是来自新媒体行业，就目前市场来看，薪资也还可以。今天的分享就到这里，每次让你了解多一点的与高考有关的信息。
